{
  "$schema": "https://json-schema.org/draft/2020-12/schema",
  "$id": "https://raw.githubusercontent.com/api-evangelist/dream-sports/main/json-schema/dream-sports-oidcdiscovery-response-schema.json",
  "title": "OIDCDiscoveryResponse",
  "description": "OpenID Connect Discovery Configuration Response",
  "x-generated": "2026-10-20",
  "x-method": "derived",
  "x-generator": "derive-json-schema.py",
  "x-source": "openapi/dream-sports-oidc-discovery-api-openapi.yml#/components/schemas/OIDCDiscoveryResponse",
  "type": "object",
  "required": [
    "issuer",
    "authorization_endpoint",
    "token_endpoint",
    "userinfo_endpoint",
    "revocation_endpoint",
    "jwks_uri",
    "response_types_supported",
    "subject_types_supported",
    "id_token_signing_alg_values_supported",
    "grant_types_supported",
    "scopes_supported",
    "token_endpoint_auth_methods_supported",
    "claims_supported"
  ],
  "properties": {
    "issuer": {
      "type": "string",
      "format": "uri",
      "description": "The issuer identifier for the OpenID Provider"
    },
    "authorization_endpoint": {
      "type": "string",
      "format": "uri",
      "description": "URL of the authorization endpoint"
    },
    "token_endpoint": {
      "type": "string",
      "format": "uri",
      "description": "URL of the token endpoint"
    },
    "userinfo_endpoint": {
      "type": "string",
      "format": "uri",
      "description": "URL of the userinfo endpoint"
    },
    "revocation_endpoint": {
      "type": "string",
      "format": "uri",
      "description": "URL of the revocation endpoint"
    },
    "jwks_uri": {
      "type": "string",
      "format": "uri",
      "description": "URL of the JSON Web Key Set endpoint"
    },
    "response_types_supported": {
      "type": "array",
      "description": "List of supported response types",
      "items": {
        "type": "string",
        "enum": [
          "code"
        ]
      }
    },
    "subject_types_supported": {
      "type": "array",
      "description": "List of supported subject types",
      "items": {
        "type": "string",
        "enum": [
          "public",
          "pairwise"
        ]
      }
    },
    "id_token_signing_alg_values_supported": {
      "type": "array",
      "description": "List of supported ID token signing algorithms",
      "items": {
        "type": "string",
        "enum": [
          "RS256",
          "none"
        ]
      }
    },
    "grant_types_supported": {
      "type": "array",
      "description": "List of supported grant types",
      "items": {
        "type": "string",
        "enum": [
          "authorization_code",
          "client_credentials",
          "refresh_token"
        ]
      }
    },
    "scopes_supported": {
      "type": "array",
      "description": "List of supported scopes",
      "items": {
        "type": "string"
      }
    },
    "token_endpoint_auth_methods_supported": {
      "type": "array",
      "description": "List of supported token endpoint authentication methods",
      "items": {
        "type": "string",
        "enum": [
          "client_secret_basic",
          "client_secret_post",
          "private_key_jwt",
          "client_secret_jwt"
        ]
      }
    },
    "claims_supported": {
      "type": "array",
      "description": "List of supported claims",
      "items": {
        "type": "string"
      }
    }
  }
}