{"issuer":"https://auth.dream11.com","authorization_endpoint":"https://auth.dream11.com/authorize","token_endpoint":"https://auth.dream11.com/token","userinfo_endpoint":"https://auth.dream11.com/userinfo","revocation_endpoint":"https://auth.dream11.com/revokeToken","jwks_uri":"https://auth.dream11.com/certs","response_types_supported":["code"],"subject_types_supported":["public"],"id_token_signing_alg_values_supported":["RS256"],"grant_types_supported":["authorization_code","refresh_token"],"scopes_supported":["email","masked_phone_number","openid","pan_verified","phone","profile","team_name"],"token_endpoint_auth_methods_supported":[],"claims_supported":["email","masked_phone_number","pan_verified","phone_number","sub","picture","team_name"]}